1;Студентов старших курсов, магистрантов и аспирантов приглашают принять участие в седьмом Энергетическом Челлендже!  ❗ Регистрация открыта до 1 апреля. Форма и более подробная информация о проекте представлены на сайте www.energyouthday.com  Проект состоит из двух основных этапов: 📍 Первый этап (12 апреля - 12 июля) – Виртуальная академия – это бесплатная образовательная онлайн-программа по энергетике с доступом к аналитическим материалам, вебинарам, дискуссионной площадке и экспертной оценке. 50 лучших выпускников Академии будут приглашены на второй этап.  📍 Второй этап (5-7 октября) – молодежный день в рамках Х Петербургского Международного Газового Форума. Это насыщенная трёхдневная программа интерактивных мероприятий с тимбилдингом, деловой игрой, встречей с руководителями компаний и др.  К участию приглашаются студенты старших курсов специалитета, магистратуры и аспиранты. Также подать заявку на участие могут бакалавры 4 курса, если они планируют летом поступать в магистратуру.  Важный фактор - уверенное владение английским языком.
0;Несколько фактов о бурундуках:   1. Забавной особенностью бурундуков является их привычка хранить еду во рту, за щеками. Если зверёк набрал много пищи, его щёки раздуваются, как два мячика. 2. За один раз бурундук способен засунуть в рот до десяти орехов 3. Защищая свои запасы, бурундуки не отступают даже перед крупным хищником или человеком, яростно нападая и пытаясь прогнать непрошеного гостя.  Планета Знаний  https://t.me/planeta_znanii/2059
1;Конференция «Консолидация русскоговорящей молодежи, проживающей в Турции»  18 марта 2021 года Русский дом в Анкаре приглашает активных молодых людей принять участие в онлайн-конференции «Консолидация русскоговорящей молодежи, проживающей в Турции». Мероприятие организовано совместно с Федеральным агентством по делам молодежи и Координационным советом организаций российских соотечественников (КСОРС) в Турции. В рамках конференции будут обсуждены вопросы развития молодежного движения российских соотечественников Турции, российско-турецкого молодежного сотрудничества, деятельности молодежных организаций и клубов России и Турции, а также работы тематических форумов, в частности, Всетурецкого молодежного форума «Продвижение». Мероприятия состоится на платформе ZOOM в 14:30 по московскому времени. Для участия в мероприятии присылайте свою заявку на электронный адрес: a.molodej@gmail.com.  [club49388164|@rosmolodez] @ksorstr #РусскийдомвАнкаре #молодежьТурции #Rusevi
0;Поступление свежей и вкусной рыбки!!!! 🐟🐟🐟 Ждём вас по адресу молодежная 30 магазин пив бад!!!!
0;ТЕПЛИЦА, КОТОРУЮ ВЫ ЖДАЛИ!!! 👍👍👍  ТОЛЬКО В ОФИСАХ ТМК👌  🚗ПОДРОБНЕЕ В ОФИСЕ ПРОДАЖ:  😍Кредит и Рассрочка😍  🏠‼ЕЖЕДНЕВНО ⏰с 10:00 до 19:00⏰‼  СУББОТА ⏰с 10:00 до 15:00⏰‼  ВОСКРЕСЕНЬЕ ВЫХОДНОЙ  ☎ 8-(921)-340-29-97 ул. Молодежная 14,  8-(931)-267-97-86 ул. Гагарина, 15💥 💥👍🏻
1;Природа требует бережного отношения: в ТАСС прошла пресс-конференция, посвященная грядущему молодежному экологическому форуму «Экосистема» ⠀ 📆 10 марта в ТАСС состоялась пресс-конференция в онлайн-формате, посвященная Всероссийскому молодежному экологическому форуму «Экосистема», который пройдет 23-27 мая на территории Вологодской области. ⠀ 📚 Форум пройдет в смешанном формате, программа будет иметь образовательную направленность. ⠀ 👫 Организаторы рассчитывают привлечь более 3,5 тысяч зрителей, консолидировать усилия молодежи на созидание и экологическое просвещение. ⠀ 🇷🇺 Одним из основных результатов станет развитие молодежного экологического сообщества во всех 85 регионах страны. ⠀ 📝 Организаторами форума выступают Федеральное агентство по делам молодежи, правительство Вологодской области, Всероссийская общественная организация волонетров-экологов «Делай!».  Фото пресс-службы ТАСС. ⠀ #делай50 #росмолодежь #экоделай50 #волонтерыэкологи #экосистема #делайвместе #эконовости50 #экологичноеподмосковье
0;Добрый день!Люди помогите пожалуйста пристроить кошечку на вид ей около года ещё молодая.Сегодня ехал с Оренбурга подобрал на трассе практически уже не двигалась,замерзла даже не мяукала.Кто то выбросил жестоко в безлюдном месте,жалко стало подобрал в машине ехала спокойно как будто привыкшая,сейчас согрелась всю кабину проехала,облазила теперь вот спит.По пути заезжал в кафешки предлагал,но ни кто не отозвался не нужна ни кому.Может тут кто то изжалится?Привезу пока к себе домой.Живем на сорокина.Орск.Добрые люди,ОТЗОВИТЕСЬ.89033697625 или 89058905962
0;ㅤ 210311 @ official_mirae twt  ' селфи со съёмок шестого-седьмого эпизодов we are future❣️ подарок от мирэ прибыл 💥 '  「 #mirae #dongpyo 」
0;Российский консул в польской Познани Игорь Ощепков не соблюдал самоизоляцию после того, как заболел коронавирусом. Его выслали из республики в начале февраля, сообщает RMF24.
0;Экстремизм и терроризм❌  10 и 11 марта специалистом МБУ «Центр молодежных инициатив ЭМР» было проведено занятие «Идейные преступления», направленное на профилактику экстремизма в молодежной среде для 30 студентов ГАПОУ СО «Энгельсский политехникум» и 28 обучающихся МОУ «Школа нового века».   В ходе беседы слушатели узнали значения слов «экстремизм», «терроризм» и каким наказанием преследуются такие преступления. Не забыли упомянуть и об опасности участия в несанкционированных митингах. Ребята с интересом слушали информацию и вступали в обсуждение данных проблем.  #ЦМИЭМР #ЦМИ64 #Экстремизм #Энгельс
0;Уважаемые жители села Адышево. 12 марта с 10.00 до 12.00 в связи с профилактическими работами на ЛЭП, будет отключена от энергоснабжения скважина на ул.Молодёжная. В связи с чем возможны перебои с водоснабжением на улицах Полевая,Новая, 70 лет Октября, Молодежная, Первомайская, часть Советской и Комсомольской.
0;Турция в апреле ☀️ ⠀ 📍Турция, Кемер ▪️вылет из Казани ⠀ 🏨 Adalin resort 4* 🗓 1 апреля (7 ночей) 💰 30538₽ на двоих “все включено” ⠀ Молодежный отель в центре Кемера. Открытый бассейн и бар около него для вашего релакса 👍🏻 ⠀ Бесплатно для вас:  • сауна  • турецкая баня  • дартс  • шахматы  • волейбол  • развлекательные программы ⠀ За отдельную плату доступны джакузи, массаж 💆‍♀️ ⠀ *возможны дополнительные сборы 🌍 офисы Йошкар-Ола, Казань, Чебоксары 📞 8(800) 505-30-12 ⠀ #семейныйчемодан #туроператор #путешествия #путешествияпороссии #турыпороссии #турция #май #майскиепраздники #турция #кемер
0;✨❓✨❓✨❓✨❓✨❓✨ А ты знаешь, как воспользоваться услугами [id343955743|Агентства трудоустройства молодежи "Профи"? ]  🤝 На базе одного из отделов «Молодежного центра» работает Агентство трудоустройства молодежи «Профи». Если ты хочешь найти работу для себя - всегда можешь обратиться онлайн в сообщениях [id343955743|пользователю АТМ], либо прийти лично. В отделе профориентации молодежи, на базе которого функционирует агентство, ты сможешь не только найти вакансии, но и получить консультацию психолога по составлению резюме, грамотной самопрезентации на собеседовании, психологии поведения в трудовом коллективе.   👩🏻‍🏫Также, ты сможешь пройти психологическую диагностику, с помощью которой, тебе будет проще выбрать будущую профессию и направление обучения.   🎧В первом из серии подкастов, подготовленных специалистами отдела профориентации молодежи, ты сможешь набегу узнать как найти Агенство трудоустройства молодежи "Профи" и воспользоваться его услугами.
0;♻ [club202298559|MeetUp "ЭкоЖизнь"] №2 будет и Чистые игры не за горами!  ✅ Сегодня обсудил новый [club202298559|MeetUp "ЭкоЖизнь"] и Чистые Игры c [id620114760|Андреем Юрьевичем Голобородько], заодно, с [id69812268|Артёмом Ярцевым] провели осмотр места, где они должны состоятся  💚 Впереди много организационной работы, надеюсь все случится, и еще больше таганрожцев присоединятся к эковолонтерству  🖊 [club92411042|Молодежный парламент], [club187938410|"Чистый след"] и [club86869128|"ЭкоБудущее"] уже готовы взяться за уборку  Ты в нашей команде ❓  #тагволонтеры #митапэкожизнь #чистыеигры #таганрог #экология #мптаг #ЭкоБудущее #ЧистыйСлед #gavr188
0;😨 КИБЕРБУЛЛИНГ И КАК С НИМ БОРОТЬСЯ  Об агрессии подростков сказано немало. Максимализм пубертатного возраста всегда приносит много хлопот. И если родители и педагоги с этими проявлениями становления молодой личности знакомы давно, то агрессия подростков, травля в интернет-пространстве зачастую остается не замеченной, пока не случится какая-либо беда.   Так называемый кибербуллинг – опасное явление современной информационной реальности. Сталкиваются с ним и дагестанские подростки. Мессенджеры, игровые порталы, социальные сети, видеохостинги, форумы – то есть в среде обитания современных подростков очень много проявлений агрессии, оскорблений, угроз, зачастую переходящих в откровенную травлю. Как защитить детей от этого? Как подростку правильно вести себя в сети?  На эти и множество других вопросов, актуальных для молодежи, отвечали эксперты круглого стола «Кибербуллинг в подростковой среде: актуальное состояние проблемы в Республике Дагестан», состоявшегося в юридическом колледже Северо-Кавказского института ВГУЮ (РПА Минюста России) с участием студентов колледжа, ДГУ и учащихся школ Махачкалы.  С приветствием к участникам круглого стола обратилась зам. директора по учебно-методической работе юридического колледжа Хадижат Абдулкадирова, отметившая в своем выступлении, что результаты дискуссии, выкладки экспертов могут послужить основанием для разработки эффективных программ профилактики и предотвращения кибербуллинга в подростковой среде.  Интересных докладов и выступлений было немало. В частности, представитель Министерства информации и печати РД Магомед Гучучалиев рассказал о работе, которую ведет ведомство по мониторингу социальных сетей и сайтов, где может проявляться агрессия подростков. Примеры и факты кибербуллинга в Дагестане привела представитель Комитета по спорту, туризму и делам молодежи С. М. Тахо-Годи. Полезными были советы руководителя Центра семейной психологии Гаджи Шамова и других экспертов, представляющих целый ряд образовательных и государственных структур, в той или иной мере ответственных за воспитание нашей молодежи. С содержательными докладами выступили студенты юридического колледжа ДГУ и учащиеся школ.  Участники круглого стола пришли к выводу, что быстрые темпы роста доступности Интернета увеличивают реальный риск кибер-виктимизации несовершеннолетних. По данным статистики, с проявлениями сетевой агрессии сталкивались более 90% опрошенных несовершеннолетних. И для того, чтобы их защитить, о проблеме нужно говорить и принимать превентивные меры. Круглый стол по данной тематике – один из шагов в этой нужной и важной работе.  #IWT #интернетбезугроз #НЦПТИ #кибербуллинг #дагестан #хейт #шейминг #виктимизация #персональныеданные
0;Рассказываем про мастер-класс «ТОП-5 ошибок из-за которых твой аккаунт не продает»🤔  Он для тех, кто ведет свой бизнес или раскручивает личный бренд😎 Максимально систематизированная информация по маркетингу, психологии рекламы и трендам 2021 года🤘🏻 Спикер — [id19752681|Мария Луговская] , руководит информационной политикой одного вуза и ведет социальные сети нескольких молодежных и коммерческих проектов😊  Пиши + в ЛС, если хочешь бесплатно стать участником мастер-класса и получить аудит своего аккаунта в Instagram👉🏻
0;Пироженое "Тоска" просто тает во рту 😋
0;Таких Блинчиков Вы Точно Еще Не Готовили/Тают Во Рту/Ароматные Апельсиновые Блинчики
0;😨 КИБЕРБУЛЛИНГ И КАК С НИМ БОРОТЬСЯ  Об агрессии подростков сказано немало. Максимализм пубертатного возраста всегда приносит много хлопот. И если родители и педагоги с этими проявлениями становления молодой личности знакомы давно, то агрессия подростков, травля в интернет-пространстве зачастую остается не замеченной, пока не случится какая-либо беда.   Так называемый кибербуллинг – опасное явление современной информационной реальности. Сталкиваются с ним и дагестанские подростки. Мессенджеры, игровые порталы, социальные сети, видеохостинги, форумы – то есть в среде обитания современных подростков очень много проявлений агрессии, оскорблений, угроз, зачастую переходящих в откровенную травлю. Как защитить детей от этого? Как подростку правильно вести себя в сети?  На эти и множество других вопросов, актуальных для молодежи, отвечали эксперты круглого стола «Кибербуллинг в подростковой среде: актуальное состояние проблемы в Республике Дагестан», состоявшегося в юридическом колледже Северо-Кавказского института ВГУЮ (РПА Минюста России) с участием студентов колледжа, ДГУ и учащихся школ Махачкалы.  С приветствием к участникам круглого стола обратилась зам. директора по учебно-методической работе юридического колледжа Хадижат Абдулкадирова, отметившая в своем выступлении, что результаты дискуссии, выкладки экспертов могут послужить основанием для разработки эффективных программ профилактики и предотвращения кибербуллинга в подростковой среде.  Интересных докладов и выступлений было немало. В частности, представитель Министерства информации и печати РД Магомед Гучучалиев рассказал о работе, которую ведет ведомство по мониторингу социальных сетей и сайтов, где может проявляться агрессия подростков. Примеры и факты кибербуллинга в Дагестане привела представитель Комитета по спорту, туризму и делам молодежи С. М. Тахо-Годи. Полезными были советы руководителя Центра семейной психологии Гаджи Шамова и других экспертов, представляющих целый ряд образовательных и государственных структур, в той или иной мере ответственных за воспитание нашей молодежи. С содержательными докладами выступили студенты юридического колледжа ДГУ и учащиеся школ.  Участники круглого стола пришли к выводу, что быстрые темпы роста доступности Интернета увеличивают реальный риск кибер-виктимизации несовершеннолетних. По данным статистики, с проявлениями сетевой агрессии сталкивались более 90% опрошенных несовершеннолетних. И для того, чтобы их защитить, о проблеме нужно говорить и принимать превентивные меры. Круглый стол по данной тематике – один из шагов в этой нужной и важной работе.  #IWT #интернетбезугроз #НЦПТИ #кибербуллинг #дагестан #хейт #шейминг #виктимизация #персональныеданные
0;СУШИ-ПОВАР,УЧЕНИК    ДЛЯ ТЕХ КТО ХОЧЕТ СТАТЬ ПОВАРОМ    Доставку суши Фарфор требуется ученики суши повара, суши повар. Можно без опыта работы,всему научим. График 2/2 , ЗП от 20-50 т. р.( по мере обучения). Молодежный коллектив, питание и доставка домой после смены.Возможно официальное оформление. т.8 9227 590 490, 8 9220119616 .с 11-00 до 17-00 ежедневно.    КОНТАКТЫ ДЛЯ СВЯЗИ:  ☎ 89227590490 - 89220119616
