0;7 000 руб за 24 часа! Первые деньги тотчас же по окончании старта системы Разрешите мне всего-лишь две минутки, и я продемонстрирую как Вы сумеете успешно заработать от 7 000 руб уже в ближайшее время.  Заработать, потратив на все это не свыше 40 мин личного времени! «семь Тыщ за 24 часа? Нереально»! Ты так считаешь? Не спеши с ответами. То, что в Интернете нельзя заколотить довольно большие средства – миф, который распространяют лентяи либо неудачники. Если уж ты точно хочешь: - заняться частным бизнесом - кончать горбить спину на «дядю» - освободится от должков - позабыть о недоступности средств - отыскать себя - иметь оптимальный доход - выполнить все свои мечты …Ты сможешь это осуществить! Преимущества по сравнению с подобными курсами: - 1-ые заработки сразу в результате внедрения приобретенных навыков. - Постигнуть и пустить в дело этот материал может всякий, начиная от подростка до пенсионера. - Гарантийное обязательство конечного результата 200% - Прибыльность не станет падать, когда вы захотите перевести дух. - Вы станете получать деньги, и Вас за это помимо того начнут благодарить! Это в целом круто! - Поддержка в течении одного года. - Выручка автоматизируется! Да , предварительно нужно немного постараться,для того чтобы подзапустить этот механизм, и затем его потребуется лишь поддерживать. - Гарантийное обязательство возвращения средств. Меня зовут Дмитрий Алемасов, мне 31 год, живу я в городе Самара. И я расскажу вам о методике доходов в Интернете употребляя которую я заработал 327.000 руб за 2 месяца. Я трачу на выполнение этой функции не более чем 1-2 часа в день, для того, что бы каждый ближайший день надежно выручать от 7000 руб. Я никому не рассказывал о этой методологии раньше, и я крайне сильно сомневаюсь, что вы найдете что-то более доходное, чем то, что советую для вас я. Я перепробовал очень много способов, рекламируемых в Интернете, однако только представленный метод дал мне результаты, каковыми я до конца доволен.
0;Хочу сделать, что-то новое, но не знаю, что именно!!! Вы когда нибудь сталкивались с такой проблемой?  Моя деятельность всегда очень разнообразна!  ✔️ Любимая работа в [club152561438|ЛПТТ имени А.К. Лысенко] ✔️Активная общественная деятельность в  [club102364323| Молодёжном совете] ✔️Реализация социальных проектов вместе с [club193051101|Новые Люди] ✔️ Журналистика в проекте [club77605267|Я ЗНАЮ] ✔️ Развитие творчества в рамках проекта #ПоэтическийРодник ✔️ Интересная учёба в #ВИВТ   И это только верхушка айсберга, ещё есть рисование, садоводство и многое другое!  С недавнего времени принимаю участие в федеральном проекте #ТопБлог. И новое задание поставило меня в тупик!!! Необходимо сделать, что-то новое! Но что можно сделать реально интересного, нового и в сжатые сроки??? Есть идея выступить на #StendUp шоу [id69106587|Дмитрия Ухлебина] уже в эту пятницу! Как идея считаете стоит попробывать?  #Идеи #юмор #Лиски #new  Спасибо за крутое фото [id290566239|Дмитрию]
0;Приветствую!✌🏻  Меня зовут Евгения  Приглашаю Вас на ❤ШУГАРИНГ❤  🚗принимаю в уютной студии  Для Вас ☕🍫🍬  🚗молодежная 82, салон " Катлен"  Я профессиональный мастер  ✅с опытом работы 5 лет  ✅Одноразовые материалы  ✅Обработка и стерилизация инструментов  🌷Милые девушки🌷  ⭐Будьте всегда красивыми⭐  ✍🏻Мой тел.: 8-912-760-48-58 (WhatsApp\Viber)  ✅Ссылка на мастера 👉 [id446357703|Евгения Строкина]
0;ВНИМАНИЕ!!! СКИДКА 5000 РУБЛЕЙ НА КУРС ПАРИКМАХЕРСКОЕ ИСКУССТВО! КУРСЫ ИНДИВИДУАЛЬНОГО ОБУЧЕНИЯ  "ИНДУСТРИЯ КРАСОТЫ" ПРИГЛАШАЕТ НА ОБУЧЕНИЕ:  Наш адрес :г. Архангельск ул. Никитова  10  ТЦ Молодёжный.  цокольный этаж.                                                      Наш телефон :+79626620265  Ссылка на нашу группу: vk.com/beautyindustrys  *ПАРИКМАХЕРСКОЕ ИСКУССТВО *КОЛОРИСТИКА *МУЖСКОЙ МАСТЕР ПО СТРИЖКАМ *ЖЕНСКИЙ МАСТЕР ПО СТРИЖКАМ *ЛАМИНИРОВАНИЕ *БИОХИМИЯ ВОЛОС *ПРИЧЁСКИ *ПЕДИКЮР *ШУГАРИНГ *МАСТЕР НОГТЕВОГО СЕРВИСА (МАНИКЮР)  ВНИМАНИЕ!!!! ОПЛАТА ЗА ОБУЧЕНИЕ ТОЛЬКО ЗА НАЛИЧНЫЙ РАСЧЁТ  УЧЕНИКАМ ПРЕДОСТАВЛЯЕТСЯ: *Большая практика на моделях *Индивидуальный гибкий график обучения *Индивидуальная программа обучения *Материалы и инструменты на время обучения предоставляются *Возможна оплата в расрочку *Трудоустройство в салоны города *Обучение ведёт дипломированный преподаватель с большим стажем работы *После обучения выдаётся сертификат
0;С целью профилактики преступности в молодежной среде, а также других правонарушений и преступлений, совершаемых несовершеннолетними, на базе ОАУСО «Парфинский КЦСО» была организована встреча подростков с инспектором ПДН ОМВД России по Парфинскому району Т.А. Тимофеевой.   На встрече были затронуты важные темы профилактики экстремистских проявлений и суицидального поведения среди несовершеннолетних.   Инспектор по делам несовершеннолетних также рассказала об опасностях общения с незнакомыми людьми в социальных сетях.  ОМВД России по Парфинскому району
1;Итак, регистрация на "ProДвижение 2021" закончена и пришло время подвести итоги!💥 Встречаем! ФИНАЛИСТЫ межвузовского танцевального конкурса "ProДвижение 2021"!!!!🔥🔥🔥   ⭐Команды STREET DANCE :   • Free Dance Family (Московский политехнический университет)   • 1 STEP CREW (Российский университет транспорта)   • LIBBAND (ФУ при Правительстве РФ)   • Amble (Государственный медицинский институт им.Сеченова)   • JK Studio (Российский государственный университет правосудия)   • Red Hell (Российский государственный университет им.Косыгина)    ⭐Солисты STREET DANCE :   • Лукьянец Марина (НИТУ МИСиС)   • Бобоев Фируз (МГМСУ им.Евдокимова)   • Сорокина Мария (РТУ МИРЭА)    ⭐Команды СОВРЕМЕННАЯ ХОРЕОГРАФИЯ:   • Коллектив современного танца "LIBERTE" (ФУ при Правительстве РФ)   • Atmosphere (ДК Московского энергетического института)   • Команда "ОК" (НИТУ МИСиС)   • Танцевальная команда "Upgrade" (Московский педагогический государственный университет)   • СтуДос (Государственный университет управления)   • Андедан (НИТУ МИСиС)   • Хореографическая студия "СЭТ" (РТУ МИРЭА)    ⭐Солисты СОВРЕМЕННАЯ ХОРЕОГРАФИЯ:   • Лаптева Елизавета (ДК Московского энергетического института)   • Дворкина Мария (Государственный университет юстиции)   • Соколовский Михаил (Московский государственный лингвистический университет)   • Зефирова Екатерина (Государственный медицинский институт им.Сеченова)      Мы хотим пожелать удачи каждой команде и обещаем, что это будет самым запоминающимся событием весны для вас!!! 💃💯🤷‍♀
0;АТАМАН СТАВРОПОЛЬСКОГО ОКРУЖНОГО КАЗАЧЬЕГО ОБЩЕСТВА РАССКАЗАЛ ОБ ИТОГАХ 2020 ГОДА    В Ессентуках прошёл отчётный круг Ставропольского окружного казачьего общества, на котором атаман, войсковой старшина Сергей Пальчиков отчитался о работе округа за прошедший год. На мероприятии присутствовали выборные казаки из всех районных казачьих обществ СОКО ТВКО.  Участие в круге принял председатель комитета Ставропольского края по делам национальностей и казачества Александр Писаренко, федеральный инспектор аппарата полномочного представителя Президента РФ в СКФО по Ставропольскому краю Юрий Бочаров, заместитель атамана Терского казачьего войска Юрий Васин, представитель ГУ МВД РФ по СК Иван Петренко.    В своём докладе Сергей Пальчиков отметил, что несмотря ни на что, в осложнённый пандемией коронавируса год казакам удалось консолидироваться и решить обширный перечень поставленных задач.  Многие культурные и спортивные мероприятия пришлось отменить, но часть удалось успешно перевести в формат онлайн. Например, ежегодный осенний фестиваль казачьей культуры, посвященный Дню Ставропольского окружного казачьего общества, а в 2020 году еще и 30-летней годовщине возрождения казачества, впервые провели в дистанционном режиме, и это позволило собрать рекордное количество участников.  Рассказал атаман о несении казаками государственной службы, работе казачьих дружин, поблагодарил за активное участие в общекраевой работе по борьбе с коронавирусной инфекцией.  – Были выставлены посты на границе региона, велась профилактическая работа с гражданами, раздавались маски и продуктовые наборы. Ежесуточно на посты выходило до 600 казаков. Я хочу всем казакам сказать слова благодарности за то, что они не остались в стороне, а активно работали ради защиты жителей края, – сказал С. Пальчиков.  Продолжается работа по взаимодействию округа с воинскими частями и организациями Минобороны России, участию казаков в организации призывных кампаний, военно-патриотическому воспитанию казачьей молодёжи. Не прекращается тесное сотрудничество казаков округа с православными епархиями и приходами, органами власти, другими национально-культурными организациями. Реализуются проекты по развитию казачьей культуры и этнотуризма.  Кроме того, с докладами выступили председатели совета стариков округа, контрольно-ревизионной комиссии и суда чести округа. По результатам работы контрольно-ревизионной комиссии было предложено поручить совету атаманов создать комиссию по разбирательству в земельном вопросе в Благодарненском районном казачьем обществе. Возможно в будущем, эта комиссия станет действовать на постоянной основе по всему Ставропольскому казачьему округу. Как отметил окружной атаман, казаки активно работают на земле, которая по-прежнему остается одним из основных источников дохода казачьих обществ и позволяет решать многие социальные вопросы, как например, рабочие места или сохранение молодёжи в сельских территориях. Но порой возникают и спорные юридические моменты, которые округ решает в интересах казачьих обществ.  На круге также был рассмотрен вопрос по утверждению новых положений Ставропольского окружного казачьего общества. Это положения «О совете атаманов СОКО ТВКО», которому по новому уставу перешли некоторые полномочия окружного атамана, и положение «О порядке распоряжения имуществом и распределения полномочий по распоряжению имуществом между органами управления Ставропольского окружного казачьего общества Терского войскового казачьего общества». Проекты положений были предварительно разосланы для ознакомления во все районные общества. Оба положения были приняты единогласно.  Новый устав СОКО ТВКО был принят на круге год назад и в январе этого года утвержден Губернатором Ставропольского края и зарегистрирован региональным Министерством юстиции России.  Единогласно деятельность атамана и правления была оценена казаками «удовлетворительно».  #stavcomnat #stavtradition #отчётныйкруг #казаки
0;Учитель комаричской школы участвует в областном конкурсе молодых специалистов.  В деятельности БРОО «АПР» традиционным стало проведение на базе гимназии №7 семинаров молодых специалистов. В этом году из-за угрозы распространения новой вирусной инфекции COVID-19 он проводится в дистанционном режиме.   Для участия в этом конкурсе (записи фрагмента видеоурока) на базе МБОУ Комаричской СОШ №1 в 5б классе молодым специалистом Максимкиной Галиной Васильевной был проведен фрагмент урока биологии по теме «Лишайники». Этот урок – открытие новых знаний. С учетом возрастных особенностей организовывалась фронтальная, индивидуальная и групповая работа. Ребята были разделены на 5 групп. Активно работая с натуральными объектами (лишайниками), различными фотографиями и схемами, используя презентацию, обучающиеся с помощью учителя узнали особенности строения и жизнедеятельности лишайников, их приспособленность к разнообразным условиям обитания, роль в природе и хозяйственной деятельности человека. Можно сказать, что урок состоялся. После его проведения учитель сделал самоонализ урока.   Андрей Дементьев писал: «Учителями славится Россия, ученики приносят славу ей». Хочется несколько слов сказать о молодом специалисте. Максимкина Галина Васильевна в 2013 году окончила филиал МБОУ Лопандинской СОШ в д.Кокино, где любовь к химии и биологии привила учитель биологии и химии Семочкина Валентина Ивановна. Затем – обучение на естественно-географическом факультете БГУ по специальности «Педагогическое образование: биология и химия». С 2018 года она работает учителем химии и биологии в филиале МБОУ Комаричской СОШ №1 в с.Быхово. За это время проявила себя дисциплинированным, инициативным работником.   Галина Васильевна выражает слова благодарности в подготовке урока и его проведении учителю билогии Новиковой Т.А. - за методическую помощь, зам.директора по ВР Черняевой С.Н. – за организацию видеосъемки и ее проведение, классному руководителю 5б класса Третьяковой Е.Н. – за участие обучающихся в этом ответственном мероприятии.   Я же желаю Галине Васильевне дальнейшего профессионального роста и удачного выступления в областном семинаре молодых специалистов, итоги которого будут подведены 16-17 марта.   Председатель исполкома Комаричского отделения БРОО «АПР» Радченко И.А.
0;ВНИМАНИЕ! РОЗЫСК! Ищем талантливых преподавателей  Владеешь английским языком и мечтаешь делиться своими знаниями с остальными? Тогда тебе к нам! Мы в поиске молодых и талантливых специалистов!  Если ты хочешь работать в молодом и дружном коллективе, иметь стабильный достойный заработок, развиваться в своей специальности, знакомиться с интересными людьми и любишь профессию преподавателя, то тебе к нам!  Почему работать в "Sherwood" здорово:  ✔современный офис в центре города (вкусный кофе, чай и печеньки прилагаются)  ✔классный коллектив (приходите знакомиться)  ✔достойная своевременная оплата труда  ✔лояльное руководство  ✔бесплатные тренинги для преподавателей  ✔креативный подход к обучению и современные методики  ✔карьерный рост, возможность официального оформления  ✔и ещё много всего интересного, о чем расскажем лично на собеседовании 🙂  🔶 Требования к соискателям 🔶  ☑ высшее образование (в идеале лингвистическое или педагогическое)  ☑ уровень английского языка не ниже С1  ☑ коммуникабельность, ответственность, вежливость, пунктуальность  ☑ грамотная устная и письменная речь  ☑ желание профессионально развиваться и зарабатывать!  Мы ценим время наших сотрудников, творческий подход и любовь к своему делу.  Присылай своё резюме на sherwood.vacancies@gmail.com.  Все финансовые и организационные подробности обсуждаются на собеседовании, запись по телефонам 095 339 29 29, 071 315 31 85.
